{
  "$schema": "https://json-schema.org/draft/2020-12/schema",
  "$id": "https://cco.dev/schemas/benchmark-suite.schema.json",
  "title": "BenchmarkSuite",
  "type": "object",
  "required": [
    "schemaVersion",
    "id",
    "taskFamily",
    "fixture",
    "promptFile",
    "claude",
    "checks",
    "trials"
  ],
  "additionalProperties": false,
  "properties": {
    "schemaVersion": {
      "type": "integer",
      "minimum": 1
    },
    "id": {
      "type": "string"
    },
    "taskFamily": {
      "type": "array",
      "items": {
        "type": "string"
      },
      "minItems": 1
    },
    "fixture": {
      "type": "object",
      "required": [
        "type",
        "path"
      ],
      "additionalProperties": false,
      "properties": {
        "type": {
          "const": "local"
        },
        "path": {
          "type": "string"
        }
      }
    },
    "promptFile": {
      "type": "string"
    },
    "claude": {
      "type": "object",
      "additionalProperties": false,
      "properties": {
        "model": {
          "type": "string"
        },
        "maxTurns": {
          "type": "integer",
          "minimum": 1
        },
        "maxBudgetUsd": {
          "type": "number",
          "minimum": 0
        }
      }
    },
    "trials": {
      "type": "integer",
      "minimum": 1
    },
    "checks": {
      "type": "array",
      "items": {
        "type": "object",
        "required": [
          "type"
        ],
        "additionalProperties": false,
        "properties": {
          "type": {
            "enum": [
              "command",
              "file-assertion"
            ]
          },
          "commandId": {
            "type": "string"
          },
          "command": {
            "type": "array",
            "items": {
              "type": "string"
            }
          },
          "rule": {
            "type": "string"
          }
        }
      }
    }
  }
}
